userName,score,at,content
M.Faiz Tamam,5,2024-05-17 15:14:54,Game nya bagus banget. Cuma sangat besar penyimpanannya udah itu ajðŸ˜ŠðŸ˜
Itz Iyan,2,2024-05-17 14:04:39,"Update Mulu, event Rerun juga ngapain harus download lagi"
S. K.,3,2024-05-17 12:52:43,"Bisa jelaskan gak?, saya tidak ada menghapus data dari Game ini, tapi kenapa jadi 5GB!?, CAPEKÂ² AKU DOWNLOAD 2 HARI DENGAN WIFI LEMOT GINI!!!, BENCI AKU!."
Alifian Pradana,5,2024-05-17 12:14:28,"1th lebih main, walaupun stuck di LV 68, gameplay nya GK bosenin, walaupun Artnya ada unsur"" seperti imut,Harem,dll. tetap bagus untuk artnya, gacha yang GK ngebosenin juga menurut sy pribadi, kemarin dapat shinano 1Ã— spin gratis aja udh seneng, dan setiap Minggu reset event weekly, titik reset digame ini sekitar jam 14.00/14.30, untuk kedepannya pertahankan dan kembangkan, kami akan memberikan masukan pada game ini kedepannya."
dicky pramono06,1,2024-05-17 11:46:10,I can't play the game after recent update !
Hujan Rina,1,2024-05-17 11:00:05,Udah di download full 14 giga tiba-tiba data nya hilang sendiri dan disuruh unduh kembali padahal hp ram 6 126 giga game ampas jangan di download
Erbin And,1,2024-05-17 09:35:46,"Gamenya bagus gw suka, tapi ada yang fatal dari ini game, yaitu loading yang tidak bisa masuk padahal udah lama menunggu selama 1 jam lebih tidak berjalan loadingnya, masa iya harus delete azur lagi? Mohon fix yostarðŸ™"
Vick â€œUzunaâ€ Schiffer,5,2024-05-17 08:21:58,ARE U READY FOR NEXT NEW UR SHIPS GUYSS ???
Ramzy Albaz,4,2024-05-17 07:45:28,Asli ini minyak digw udh bnyk dan gbisa diclaim lgi tolonglah tambahin fitur berbagi sesama player satu lagi bahan yg dimessage gbisa diclaim cuma gara gara minyak kebanyakkan
Yuvan,1,2024-05-17 04:29:28,Habis update kenapa download ulang data lagi??
vynnx,5,2024-05-17 03:47:52,"ok, i give up to play this game, my phone can't handle this major update"
VELMS,5,2024-05-17 02:53:56,Game nya bagus banyak tobrutðŸ—¿
Zero,5,2024-05-17 02:19:33,Game baik + game GG
Eriza,5,2024-05-17 01:20:59,Besar besar game baik ðŸ™
KRI chiwa,5,2024-05-17 01:00:36,Game yang seru pernah gw mainin kalau bisa tambahkan kapal dari indonesiaðŸ˜…
Rhenal F,5,2024-05-17 00:44:42,"Game ini adalah salah satu game terbaik yang pernah saya mainkan. Namun, dock saya sudah penuh dan tidak bisa bermain lagi. Jadi saya memutuskan untuk berhenti sampai ada event gem gratis agar saya bisa membeli dock tambahan. Saya akan selalu mengikuti update game Azurlane di Facebook dan Twitter. Terimakasih Azurlane."
RIO GAMING,5,2024-05-17 00:29:14,Game terbaiku
anggi alfian,1,2024-05-16 23:56:47,Update terburuk
Î»lpha MW,5,2024-05-16 23:46:07,ukurannya jangan nambah lagi biar ram 3 kayak saya masih bisa main
anta kusuma,5,2024-05-16 23:31:37,Oyy ini kenapa abis update g busa di main nin
Iori 13,1,2024-05-16 23:29:37,Setelah update kemaren jadi kagak bisa login cuma stuck di loading mulu terpaksa pensi deh padahal akunku udah lumayan jadi
rizal putra,5,2024-05-16 22:43:55,Good
Aku Dewe,5,2024-05-16 21:51:47,Yipeeee now ist workkðŸ˜†ðŸ˜†
Black Star,4,2024-05-16 20:13:36,Blank screen reinstall.. Some one tell me what happen with this game
Tayoo TM,1,2024-05-16 19:00:27,wth.!! re download 11GB....!!!!! I'd better stop playing.....
M Dzaki Zimbbran,3,2024-05-16 18:58:13,"Terlalu Sulit mendapatkan kapal UR, sulit juga untuk mengumpulkan Gear SR, dan sering mengalami stack di loading game tanpa bisa masuk ke dalam game setelah maintance"
M. Aditia Hadiansyah 6C,2,2024-05-16 18:51:12,Harus kah patch sampai memakan 20 Giga byte? Haruskah mendownload data yang bahkan tidak penting dan masalah yang tidak pernah dialami?!
Feri Frij,1,2024-05-16 17:53:03,Parah amat ni game semakin di update malah smkin gk bs lg diputer. Pdhl perangkat yg gw pake udh OS 11. Udahlah gw delete aj ni game
Rohman Rohman,4,2024-05-16 17:38:55,"Jujur ini game udah bagus cuman kurang 2 hal, gems lebih mudah di farming, SAMA KALO TIAP UPDATE WAJIB BANGET KAYAKNYA ADA MASALAH SETIAP SEHABIS UPDATE ATAU MAINTENANCE"
Yurina 3k,5,2024-05-16 17:37:24,"Cant login after update 1,3gb..help game master"
Muhammad Dani Dermawan Kadir,1,2024-05-16 17:28:09,"Can't be played, stuck on blank screen after manjuu logo, i'm using POCO M6 pro"
Muhammad Fahmi,1,2024-05-16 17:17:37,"Setelah update malah tidak bisa masuk game :( padahal udah nungguin lama + update nya 1 gb anðŸ™‚. Update supaya tidak ada bug, eh setelah update ada bug, agak laen."
Samudra Lazuardi,1,2024-05-16 16:37:10,"Setelah update terbaru gak bisa dimainkan gamenya. Bukan dari memori atau apa apa lagi, pas update dari G playstore dan dibuka. Langsung skakmat di layar ""Loading game"" tros. Fix ini dan Berikan Apologems YOSTAR"
Afda Lul,1,2024-05-16 16:28:53,Loading nya malah makin lama
rama Wanted,1,2024-05-16 16:08:54,Setelah update gk bisa masuk stuck loading. Kecewa. Ukuran gk kecil.
Nomian Official,5,2024-05-16 15:52:52,"I am sorry, i'm stucking in loading screenðŸ˜­ðŸ˜­ðŸ˜­"
Ibrahim Achmad,5,2024-05-16 15:20:56,"Come on Dev, give me a chance to get even bigger new Jersey. When it's only 1.2%, I've gacha up to 101 times but haven't gotten New Jersey yet. Come on, poor f2p people, you have to top up to get it New Jersey. I'm from Wisdom cube 90 to 8 never got new Jersey. You have to get 200 gacha to get it. Hurry the event is over."
Mahfuzh Ihsan alghifari,1,2024-05-16 15:13:44,Ini udh di update lama benar.
Re Nan2513*,2,2024-05-16 15:09:51,Too many bug ex= i can't login after update the game
Yoseph salditra,1,2024-05-16 15:06:00,Bad very very bad
Nafis,5,2024-05-16 15:05:59,"Build character ok, game play ok, event ok, ukuran gede ðŸ˜­, tapi bisa di download setengah, ok"
Just_Nagi,5,2024-05-16 14:49:29,Pc version please!!!!!!!!
Muhammad Marfin,5,2024-05-16 14:38:31,Tolong tingkatkan kesempatan untuk dapat kapal sr dan ur tolong
M.FAISHAL H.M,5,2024-05-16 14:23:48,Good
ãƒªãƒ³å¿—æ‘©,3,2024-05-16 14:18:56,"Gamenya cukup bagus, tapi setiap update selalu tidak dapat dimainkan"
Mang Thanos,5,2024-05-16 14:13:20,habis update ko susah login padahal buka apl lain lancar lancar aja ngebug kah?
Ridzky Machardi,1,2024-05-16 13:21:40,"after update when.login loading always stuck,cnt enter game need to reinstall"
Dede Kusumah,1,2024-05-16 12:48:35,Setelah update terbaru saya tidak bisa masuk ke dalam game. Stuck di loading game
Ghofur A.M,5,2024-05-16 12:44:21,The only game who could make me fall in love with anime girlâ¤ï¸â¤ï¸â¤ï¸
Didit Aditya,2,2024-05-16 12:35:41,Kenapa setelah saya update gamenya kenapa tidak bisa masuk hanya tulisan loading saja
Keanu Antonius,1,2024-05-16 12:33:43,"Bro this game suck I just 2 or maybe 1 days does not log in cause an work, when I was going to log in it was say it's need an playstore update after I update it it's never going to log in I even just let it for 1 hour but still not log in bro what is wrong with this game I want to meet biscuit!"
Muhammad Nursahbani,5,2024-05-16 12:25:59,Luar biasa ðŸ˜ðŸ˜ðŸ˜
BIMANTARA KRESNO AJI,4,2024-05-16 12:16:22,Setelah update versi terbaru tidak bisa login
bang bang,5,2024-05-16 12:04:39,i like ship
Zidane Pratama,5,2024-05-16 11:21:23,Bagus banget >~<
Dipo Natanegara,5,2024-05-15 19:52:10,NICE
DENDY MA,3,2024-05-14 15:29:05,"mohon maaf sepertinya saya mendapatkan bug pada dialog di operasi siren, dimana sebuah pilihan pada dialog text box tidak bisa eksekusi ke dialog selanjutnya malah stuck saat sesudah memilih dialog box, tolong segera di perbaiki"
Cep Supendi,5,2024-05-12 18:29:33,"Wow, game ini sangat bagus dan santai untuk dimainkan ðŸ˜ƒðŸ‘"
Vizz_,5,2024-05-12 02:17:41,à¬˜(à©­ á› )à©­~~â­â­â­â­â­.*ï½¥ï½¡ï¾Ÿ
qia Nul,5,2024-05-11 12:54:48,Game looks cool but it could lag your phone a bit but ITS a great game! You should download it even though ITS laggy ITS worth it i promise!
Supri Yanto,4,2024-05-10 01:47:03,"Pls, yostar, when i tap the download data it keeps auto closing, pls fix this..."
Valencia Valencia,5,2024-05-06 16:22:16,Nice
Bramantyo Lawu Aji,2,2024-05-06 14:29:53,Loading nya lama banget sampai 1-5 bulan tapi grafiknya emang bagus tapi tolong untuk loading nya dipercepat
vynnx,5,2024-05-06 14:08:11,i still waiting for the pc version :)
Alvino Yoga P,1,2024-05-01 23:50:12,GAME KEBANYAKAN DOWLOD DATA
Lies Truth,4,2024-05-01 04:31:33,Tolong adakan pilihan untuk setting grafik jadi lebih rendah. Jangan hanya pilihan fps saja.
fitrah ardiansyah,5,2024-04-30 14:09:33,Fitrah ganteng sangat suka sekali azur lane ðŸ˜˜ðŸ˜˜ðŸ˜˜
Reznova Blyat,5,2024-04-30 10:38:14,"Very nice bro ðŸ˜‰ðŸ‘Œ (The developer is good and I was given even more rewards, thank you GDEV and his team) [Even though the characters are all great, they're not bad] âœ“"
Nggaa,5,2024-04-29 15:25:58,omagyat ambatukammmmmm
Dominic,5,2024-04-28 21:11:44,Game terbaikkkk
X-4_Muhammad Danendra,5,2024-04-28 10:30:32,Aku n
Abdul Karim,1,2024-04-28 06:11:31,Game 4no berkedok game kapalðŸ˜‚ðŸ¤“
Arsyad Linov,5,2024-04-27 22:43:23,Ralley cool
Kadal Telur,4,2024-04-27 16:32:00,Njer baru main udah 17GB xP kukira bisa offline mana Kurang banyak lol:'3
Alif Alfarizki,1,2024-04-26 23:35:32,"Why is it that after the update there is a bug, when I log in to the game the error is stuck on the loading screen even though the network is running smoothly, please fix it"
Yamamoto Hiromori,5,2024-04-26 13:35:04,"Not really like the new update, it make the UI inflexible, but other than that it's good"
Dheat Crown,5,2024-04-26 11:18:45,Aku suka sama anime nya dan game nya pun bagus ... Tingkat kan terus developer ni game udah bagus ... Apalagi soutrack lobby nya bikin player semangat main ... Alur ceritanya juga mirip sama anime ... Mantab dah grafik ok cmn kurang dari game ini hanya pas kita battle kamera sama hero kita terlalu jauh
legzeS xd,4,2024-04-26 09:51:40,Good game
Sugek Tyo,5,2024-04-26 04:17:32,ðŸ˜ðŸ‘ðŸ’¯ðŸ˜…
Fauzi Raya,5,2024-04-25 22:29:54,Kawai kawai beauty beauty the best game ever in my life
Dafa King bizon,5,2024-04-25 10:22:38,Mik e gedi
VICDAN Mustafid,4,2024-04-25 03:29:36,Tiap battle ngefreze di hp gwðŸ˜•
Muhammad Fauzan Afnan (ãƒ•ã‚¡ã‚¦ã‚¶),5,2024-04-24 13:11:12,Sangat Ramah untuk pengguna ðŸ‘€.
Vitra Ramadhan,5,2024-04-24 09:52:14,Game ny bagus
MLian Nadim,5,2024-04-22 03:30:35,Dev tolong tambah kapal induk ijn yogana kapal induk kelas dari Ijn taiyo
Athallah Firdaus,5,2024-04-21 04:30:55,"Sebaiknya kalian JANGAN pernah keluarin gamenya pada saat download data karena bisa menyebabkan stuck di loading screen (update complete, loading game). Jadinya sekali download harus langsung download semuanya jangan setengah-setengah. Karena gw udah mengalami itu 2 kali malah jadinya harus download ulang dari awal. Kalo emang gak bisa login alias stuck, JANGAN dihapus dulu. Tunggu sampe update berikutnya, bisa dimainin apa gk. Kalo bisa ya baguslah karena gw nunggu update bisa. Full Size: 17 GB"
Russt suka rendang,5,2024-04-19 14:20:10,Game sampah cuman umabar TT doang gaada fitur tenjangðŸ˜ˆðŸ˜ˆ
Neymar Lionel,1,2024-04-16 03:47:30,"Bang gwe mau main tapi gak bisa karena download sampai 10 gb gwe hanya ada storage 4,97 pils la devoloper azur lane kasih kecil gane nya sihhinga download size game jadi ada option ke 3 plis"
Irfan Farhan,1,2024-04-15 09:06:14,"Baru download di playstore dan Setelah download data 10gb malah stuck di loading. Sungguh mengecewakan ðŸ˜¤. Mungkin aku tidak di beri kesempatan memainkan game ini, y udh lah uninstal aja. Terima kasih karna telah membuang waktu saya."
V M,5,2024-04-15 07:03:30,"Saya sudah bermain cukup lama dan sempat berhenti bermain, tapi ketika ingin bermain kembali akun saya sudah hilang bisa bantu kembalikan akun saya"
Axeit,5,2024-04-14 10:59:23,"ini game tidak kikir seperti game sebelah, banyak event gratisan buat gw yang f2p tengkyu yostar"
Rafly Ardiansyah,1,2024-04-14 05:33:38,"to developers, after the latest update, I am having a really hard time getting SSR tier characters and UR tier characters in every ongoing banner, both banners for new characters and banners for rerun characters. Please improve the character pull system so that this game is more fun and enjoy to play. Please don't turn it into a game that is stingy to all players of this game. I hope this case will be resolved properly soon. thankyou very much"
Ahmad Alpianoor,3,2024-04-13 20:35:06,Update yg sekarang sdh kelewatan besar jadi ngelaq Mulu dah
BOY 122,5,2024-04-13 19:04:44,Gk ada fitur telanjang
Arkantos 0314,2,2024-04-13 10:40:57,Please add more fox girls
Faozhil Nofrian Madjid,5,2024-04-13 09:40:02,Game bokep anjgðŸ¤£ðŸ˜‚ðŸ¤¯
NEHAN Fajar,5,2024-04-13 05:06:14,Semoga hoki dapet ultra rare atau GK super rare
Nouval krisna,5,2024-04-12 15:38:40,Mantep to yo rek
Gibral Tar's,5,2024-04-12 06:22:56,"Game yang sangat mendidik,memberi kepuasan dalam bermain ðŸ˜ðŸ‘"
Shin Shin,5,2024-04-12 03:51:34,"The game is already good and has a variety of characters, but I hope you add several languages such as Indonesian"
Aku Siapa,1,2024-04-09 12:33:10,Game babiii
Fadhel M,5,2024-04-08 07:42:19,Kapan update lagi :) baru update setahun yang lalu.. pliss lah dev.. kalo mo ngeupdate perbarui.. di tambah.. kasih lah tempat farming sendiri biar gk bosen ngulang stage Mulu.. kasihlah rekomendasi kecocokan kapal..dan tolonglah tambah event.. terakhir.. tolonglah percepat coldown material.. gw males nungguin..
Heriyanto Heriyanto,5,2024-04-06 13:26:09,MenggodaðŸ˜‹
sultan sukmahakim,1,2024-04-05 07:35:50,"Sebenarnya game ini sudah bagus, tapi masalahnya untuk gacha dapetin kapalnya itu susah banget dan juga gear nya itu juga masalah, dan juga gak bisa direset kembali itu yang paling masalah nya saya ingin reset akunnya tapi gak bisa, jadi saya berpesan kepada yostar untuk memperbaiki semua kesalahan tersebut"
Rahmat Akhmad,5,2024-04-03 23:07:07,ðŸ¥°
maba beraksi,5,2024-04-03 05:30:06,Gamenya keren bisa cari waifu juga
Muhammad Rizky Ramadhan,5,2024-04-02 21:01:29,Papih aku masih dendam sama papih papih gak kasih Aku guamm Papih jahat banget sama aku ðŸ˜­ðŸ˜­ðŸ˜­ðŸ˜­ aku dah berusaha buat ngumpulin cube tapi ama papih gak di kasih masa papih cuma kasih aku Zwei doang ðŸ˜­ðŸ˜­ðŸ˜­ðŸ˜­ papih jahat banget.... Papih aku nitip aku ku namanya Cantya aku titip mereka ya papih bulan abis bulan puasa kau comback lagi main game nya yaaa... Papih kan kesayangan ku aku sayang papih yostar
Honkai Gamer,3,2024-03-28 02:08:21,"This game has been running for 6 years but why isn't there a skip button for completed stages? As someone who has played a lot of games, on average they use the skip feature for stages that have already been completed so that I have the same excess stamina to progress quickly."
Z u l l,5,2024-03-27 16:30:51,"Aku mohon kepada pihak developer untuk memberikan expansi lebih untuk dock karna setiap saya ingin menambah dock itu memerlukan diamond ,iya sih diamond terkadang di berikan gratis tapi itu butuh waktu lama (f2p) ,saya sampai bingung mau gacha kapal tapi dock gak cukup karna udah penuh Jadi saya mohon untuk lebih di mudahkan atau ada cara lain lah terserah ,overall good game"
MuhammadBasyor NurIndrawan,3,2024-03-27 00:55:32,"Semakin Update Semakin Error, Suka Berhenti Di Loading Screen, Kadang Juga Suka Network Disconnected Hah Agak Kecewa :("
Ucup Frontal,3,2024-03-25 05:54:32,"dear yostar, how do I solve the problem of updating 6.5kb data?, My application has been like that for a week, while all the data has been downloaded, please respond"
Muhammad Akbar N,5,2024-03-24 22:58:03,Game yang sangat bagus
Budi Darmawan,5,2024-03-23 11:31:22,I cant play without oil ðŸ˜­
Uzaki- Chan,1,2024-03-21 10:00:18,Kenapa aku ngga bisa download ini game ðŸ¥²
Haarlem,5,2024-03-21 05:40:12,Thank you so much
Xymperor Shin,5,2024-03-20 21:34:04,Please add a sweeping feature for each stage to make it easier when the stage has been completed
Akmal al ghani,5,2024-03-19 16:32:35,OK
FAHRUL ROZI,5,2024-03-18 04:02:11,I like this game
Risky,4,2024-03-15 02:39:03,"Untuk gameplay oke banget, kekurangan nya yaitu tolong tambahkan bahasa agar mempermudah membaca, contohnya bahasa Indonesia."
sapta mihawk,5,2024-03-14 17:07:23,#1 game gacha paling ramah terhadap player f2p
Illia Sewu,5,2024-03-14 13:35:58,"Always ""Checking for updates"" !!!!!!"
Ardi Wakwaw,2,2024-03-14 10:49:41,Amazing
Oreki24,5,2024-03-13 17:44:54,"Alamak bintang 5, waifunya gila sih, dan setiap karakter punya aset masingÂ² yg kecil ada apalagi yg besar. Sheesss ðŸ˜‹"
Nabil Fauzan,5,2024-03-13 00:54:42,Terimakasih game baik ðŸ˜
Lumine,5,2024-03-12 21:43:34,Cara biar character nya telanjang gimana gan?
Kurumi.,5,2024-03-07 12:58:55,game yang agak porno tapi mantap
nico saber,5,2024-03-06 04:06:44,"Baru ini game, yg dah 2 tahun awet gw mainin."
Ahmad ibnu Sabri,5,2024-03-05 16:18:09,Kerja bagus
ExChanscze,5,2024-03-05 15:07:53,Game ramah f2p
joe,3,2024-03-04 04:29:12,"edit,tolong buat dock slot char bikin unlimited aja,mw koleksi char kepentok dock full trs.."
Shinji Asakura,5,2024-03-02 23:50:06,"Abis update, main game ini berasa punya anak sendiri wkwk"
Pengguna Google,1,2024-03-01 17:54:04,Gacha ur ampas auto pensi
Dark Shadow,5,2024-02-29 14:27:54,Bagus
Hafiz Hadiansyah,5,2024-02-29 14:05:10,"ya dari karakter very very very good and beautiful, dari game play lumayan juga dan ada event untuk bermain bagus lah, dan cuman satu terkadang untuk menaikan chapter main harus naikin level kita dan itu lumayan sangat lama mungkin kedepannya bisa di potong sedikit saja"
Septian Fabiano,5,2024-02-28 23:26:19,Mantap mennn
Yuuki Hirasawa,5,2024-02-27 20:46:01,farming waifu
yutube geratis,4,2024-02-27 11:49:47,gachanya terlalu gampang
Kapten Rdi,5,2024-02-27 07:02:49,Best anime art style game i've ever play in this phone:)
DARK NIGHT,4,2024-02-26 14:10:45,"Game nya keren, tapi tolong Tambahin bahasa Indonesia nya dong"
Putra Trans_official,5,2024-02-26 05:15:04,Tambahin translate bahasa Indonesia
Rein Septiansyah,5,2024-02-25 12:41:35,Soundtrack dan musik yang sangat bagus
Kinzi San,5,2024-02-25 05:23:33,Terimakasih sudah membuatkan Prinz Eugen yang cantik karena dia adalah istri sayaðŸ˜‹
Lincorns 1997,3,2024-02-24 05:09:00,I'M stuck after update pls fix it!!
M. Nabil Ibadurrahman,5,2024-02-23 23:32:06,Gg aku dapet urðŸ˜†
Deo Pebriansyah,5,2024-02-22 10:21:44,Nice gameðŸ‘
Rendy Jayadi,5,2024-02-19 13:49:11,Oke
Wildan Ramadhani,5,2024-02-19 12:38:54,Alamak... Gede nyeee
Alexander Christian Dwi Putera,5,2024-02-16 10:03:31,Kumpulin kapal waifu kalian
Yoga Fernando,5,2024-02-16 08:54:03,Boleh lah
Wiwit Sugiarti,5,2024-02-16 08:06:20,Bagus :)
ZAQ,5,2024-02-15 19:42:11,Nice game
otaku PS,5,2024-02-14 09:11:46,balek lagi karena binggunggggg maen apa
Nayuta,5,2024-02-11 09:11:23,Huan Chang menggodaðŸ˜‹
Vern 19,5,2024-02-11 05:00:45,"Sudah bagus gamenya. Cuman, disaat saya sudah susah-susah kalahin boss dalam satu stage, ternyata stagenya masih belom tuntas, gak nyaman dan bikin malas :).. mohon dipertimbangkan lagi"
3. Yudha Harwanto P.,5,2024-02-10 16:17:42,"Ada bug ketika memilih choice yang akan dilakukan yaitu tidak bisa di klik dan berganti aksi,hanya stuck saja tidak bisa di klik"
galuh helga Rifqianto,5,2024-02-10 16:02:43,Gem baik
Muhammad aulia Zikra alfahrezi,5,2024-02-10 10:07:47,Gah
Reza Sp,1,2024-02-10 05:58:39,"Game gk jelas baru masuk udah black screen,instal ulang masih sama buang buang kuota"
Wildany Laksmana,1,2024-02-09 11:04:31,"Gamenya bagus, download data nya gk bagus,dikitÂ² update"
Alfrida Onang,5,2024-02-09 10:01:41,Saya kasih bintang 5 bagus game nya
Yuko Auron,5,2024-02-09 05:55:31,ðŸ‘
Thecikal Boy,1,2024-02-08 18:16:43,"its really hard to farm, at least make fiture to compose or convert all mats till T3"
SHIRONEKO87,5,2024-02-08 11:00:23,"mantapp jiwaaaaa, fan servicenya mantap skli"
Agus Sucipto,2,2024-02-08 10:42:51,"Tambahkan bahasa Indonesia, please!ðŸ˜­ðŸ™"
Johan Christianto,5,2024-02-08 07:45:22,"Keren lah, gw bisa memiliki istri disini walaupun 2D itu bisa ngilangin rasa kesepian ini"
iloo,1,2024-02-08 02:14:56,"baru download stuck di loading doang ,ga bisa masuk kedalam gamenya, seumur hidup baru kali ini Nemu game kaya begini, download gede tapi ga bisa di mainin buang waktu"
Alvian nurjanah tri admaja,5,2024-02-07 14:25:26,Nice
IJN Shinano,5,2024-02-06 15:41:23,Game nya keren asik dan ramah ðŸ˜
Rifin YGO,5,2024-02-06 14:23:42,"Reward MT tolong tambahkan dong, kasih cube gratis"
M RASYA,5,2024-02-06 05:37:31,Good game
refan setiawan,5,2024-02-03 06:12:12,"gemenya keren, gachanya mudah, gameplay simpel.tapi untuk kedepannya tolong tambahkan beberapa skin oath di beberapa waifu seperti SHOKAKU, Bismarck, dan lainnya."
Yuzuru Yamai,5,2024-02-02 23:38:29,Mantep game nya ukuran karakter nya juga gede jadi makin puas main nya
Bayu Syahputra,5,2024-02-01 06:55:27,"Untuk game nya, jujur sudah bagus. Dari main Campaign sampai war archive nya juga masuk,"
Didot BIOEZ38,5,2024-01-31 03:28:59,Makasi haa wawakau
robby hartanto,1,2024-01-30 14:05:24,one of my friend got hacked but the CS telling him that he using vpn. and the CS doesn't except a video as proof. what a joke.
Andika,1,2024-01-30 08:40:21,"Gacha selalu ampas, masa menghabiskan banyak wisdom cube masih gak dapat. Dan saya memutuskan untuk pensiun aja, ini hanya membuang waktu saya"
Igede Nandapramaditha,5,2024-01-28 04:13:27,"gem ya dah bagus,tapi tolong di tingkatkan lagi supaya tidah loding lama dan supaya semua pemaing bisa bermain dengan yaman.."
Jin Al Leo,5,2024-01-26 09:07:40,"Dear Yostar-sama... Give me New Jersey or I Will cook your manju... Btw Nice game, I like it..."
Yama,5,2024-01-25 12:29:17,"Tolong bang developer khususkan karakter Sirius untuk gw, walaupun ini bukan hari Rabu"
Aditia Thoriq Rasidin,4,2024-01-23 14:42:39,Kurang menarik
Havierre,5,2024-01-23 11:44:59,gem bagus ini penuh dengan wanita2 sexy nan mulusðŸ¥°ðŸ˜
Muhammad Rizky Akbar,5,2024-01-22 11:12:24,I need pledge outfit for shinanoa!!!!!!
Dhanyi Irawan,5,2024-01-21 08:10:24,Dev please kurangin dong size game nya saya sudah berkali kali terlewat oleh event yang bagus karena handphone saya yang tidak memadai game ini untuk full download mungkin kalau bisa dikurangin size game nya ya saya cukup keberatan akan hal itu padahal dlu 5GB sudah bisa full download sekarang 5GB hanya bisa main campaign
Atlas Montage,5,2024-01-21 07:43:47,ada susu animeðŸ¥µ boing boing
Asvin Altair 4478,5,2024-01-19 23:21:25,Waifu cui ðŸ˜…ðŸ‘
Dana,1,2024-01-19 16:39:27,server eror di little entreprise tolong bantuannya di translite di bahasa Indonesia nya admin
kevin Ortega,5,2024-01-19 15:32:57,nice.......
nanda Sena,5,2024-01-18 14:32:05,I like game
Rafa Maulana,5,2024-01-18 09:16:29,"Satu kata buat game ini... KEREN !!! dan juga sedikit saran dari gw,klo bisa update selanjutnya tlong ukuran dorm nya tlong di perbesar,karena klo menurut gw ukuran dorm saat ini terlalu kecil ðŸ˜…ðŸ˜…ðŸ˜…. Satu lagi, utk event klo bisa di buat agar ramah pemula, soal nya kasian org2 yg baru main dan ingin ngerasain event nya, terimakasih gw ucapkan kepada developer yg udah bikin game ini,sekali lagi game ini KEREN !!!"
Yudha Dxd,5,2024-01-17 05:08:04,Nice game
A_Ade Kurniawan,5,2024-01-16 12:58:53,Best gameðŸ”¥
Bagas Nuryaken,5,2024-01-15 02:58:25,Game bagus banyak skin mantapðŸ‘ðŸ‘
Ren Kunh,5,2024-01-14 14:22:11,Tobrut parah jir
Nothing_ 2,5,2024-01-14 06:58:06,Gamenya bagus tapi lumayan susah juga buat ngumpulin crystalnya
Muhammad Nizzar,5,2024-01-13 16:22:54,"Good game,I play this game beside Modern Warship,and do you know what happen?,yeah a balance is established. Greeting from Indonesia."
Muhammad Dzulqornain,5,2024-01-13 11:30:09,"The game is good, the game play is also good, the events are also various, the ships are also quite numerous and very tempting ðŸ˜‹ðŸ˜‹ðŸ˜‹, the signal is also good but when updating please don't suddenly almost Every week there will be continuous updates Hopefully Yostar will reply ðŸ™"
Smart Play,1,2024-01-12 22:45:06,Bener bener ga tau apa seru nya ?
VanzX ZM,5,2024-01-12 14:39:09,Game nya bikin ngantuk ku kasih bintang 5 karena waifu pada2 gila mana tahan coy ðŸ˜
Danah Mifta,5,2024-01-11 05:44:49,Tidak ramah untuk dimainkan di tempat umum
What nime,1,2024-01-10 14:02:12,Kenapa akun saya hilang padahal saya main 2021 pensiun terus buka lagi ko udh gk ada akun saya ðŸ˜­
ALVITO DF,5,2024-01-07 15:34:39,ðŸ¥°ðŸ¥´
UnFunnyGuy,5,2024-01-07 15:06:42,Untuk sebuah alasan... Gw download ini...
Ahmad Rafii,5,2024-01-07 06:05:14,Mommy
mhflvi_,5,2024-01-06 16:34:29,Nice game
Fitrah,5,2024-01-06 16:06:18,"Bang udah lah bang iya bng gw ga lgi pamer"" skin bng momo gw ga cukup bng pada hal gw mau download lo bang"
hans cristian,5,2024-01-03 17:38:01,Kenapa saya tidak mendapatkan yumi tapi malah di spam fubuki
Sora,5,2024-01-03 05:29:34,please add Indonesian language. that's it thank you ðŸ‘
1048_Muhamad Imam,5,2024-01-03 00:10:03,Taihou hot bangettt ðŸ¥µ
Muhammad rafli Effendi,5,2024-01-02 22:13:22,"really a good game, the characters match the names of the ships in the real world"
Ammar Craft,5,2024-01-01 13:03:59,"Bansosnya banyak cuy, worth buat f2p"
Agustian Apriyanto,5,2024-01-01 08:28:08,Akuh suka kapal lautðŸ˜‹
Arbii Ganzz,5,2024-01-01 07:04:12,Mantap
Dio,5,2023-12-31 12:56:24,Bagussszzz lebih baguss ad Bahasa Indonesia.
luke skywalker,2,2023-12-30 11:41:41,"Halo Yostar, saya ingin memainkan akun lama tapi akun tersebut malah mengulang dari awal, apakah ada cara untuk recovery akun yang sudah hilang. Terimakasih"
shinamahiru,5,2023-12-29 14:25:16,ðŸ˜‹
Romadlon Achmad,1,2023-12-29 01:47:19,"Tolong segera diperbaiki, setelah update kok tetap di layar loading hampir 8 jam"
GAMER COLD23,5,2023-12-28 10:13:33,bro waifu sekali pada permainan iniðŸ˜­ðŸ˜­ðŸ˜­
